{
  "blockers": [
    "evaluation_blocker:contractnli:archive_not_acquired",
    "evaluation_blocker:contractnli:licence_not_reviewed",
    "evaluation_blocker:contractnli:quarantine_not_compiled",
    "evaluation_blocker:contractnli:seal_missing",
    "evaluation_blocker:contractnli:version_not_pinned",
    "evaluation_blocker:evidence-inference:archive_not_acquired",
    "evaluation_blocker:evidence-inference:licence_not_reviewed",
    "evaluation_blocker:evidence-inference:quarantine_not_compiled",
    "evaluation_blocker:evidence-inference:seal_missing",
    "evaluation_blocker:evidence-inference:version_not_pinned",
    "evaluation_blocker:glucose:archive_not_acquired",
    "evaluation_blocker:glucose:licence_not_reviewed",
    "evaluation_blocker:glucose:official_archive_not_resolved",
    "evaluation_blocker:glucose:quarantine_not_compiled",
    "evaluation_blocker:glucose:seal_missing",
    "evaluation_blocker:glucose:version_not_pinned",
    "evaluation_blocker:maven-ere:archive_not_acquired",
    "evaluation_blocker:maven-ere:licence_not_reviewed",
    "evaluation_blocker:maven-ere:quarantine_not_compiled",
    "evaluation_blocker:maven-ere:seal_missing",
    "evaluation_blocker:maven-ere:version_not_pinned",
    "evaluation_blocker:proofwriter:archive_not_acquired",
    "evaluation_blocker:proofwriter:licence_not_reviewed",
    "evaluation_blocker:proofwriter:quarantine_not_compiled",
    "evaluation_blocker:proofwriter:seal_missing",
    "evaluation_blocker:proofwriter:version_not_pinned",
    "evaluation_blocker:vitaminc:archive_not_acquired",
    "evaluation_blocker:vitaminc:licence_not_reviewed",
    "evaluation_blocker:vitaminc:quarantine_not_compiled",
    "evaluation_blocker:vitaminc:seal_missing",
    "evaluation_blocker:vitaminc:version_not_pinned",
    "evaluation_blocker:wiqa:archive_not_acquired",
    "evaluation_blocker:wiqa:licence_not_reviewed",
    "evaluation_blocker:wiqa:quarantine_not_compiled",
    "evaluation_blocker:wiqa:seal_missing",
    "evaluation_blocker:wiqa:version_not_pinned",
    "evaluation_licence_not_approved:contractnli",
    "evaluation_licence_not_approved:evidence-inference",
    "evaluation_licence_not_approved:glucose",
    "evaluation_licence_not_approved:maven-ere",
    "evaluation_licence_not_approved:proofwriter",
    "evaluation_licence_not_approved:vitaminc",
    "evaluation_licence_not_approved:wiqa",
    "evaluation_not_sealed:contractnli",
    "evaluation_not_sealed:evidence-inference",
    "evaluation_not_sealed:glucose",
    "evaluation_not_sealed:maven-ere",
    "evaluation_not_sealed:proofwriter",
    "evaluation_not_sealed:vitaminc",
    "evaluation_not_sealed:wiqa",
    "existing_lake_audit_not_ready",
    "public_confirmatory_not_ready",
    "public_evaluation_not_ready:contractnli",
    "public_evaluation_not_ready:evidence-inference",
    "public_evaluation_not_ready:glucose",
    "public_evaluation_not_ready:maven-ere",
    "public_evaluation_not_ready:proofwriter",
    "public_evaluation_not_ready:vitaminc",
    "public_evaluation_not_ready:wiqa",
    "quarantine_index_missing",
    "quarantine_not_ready",
    "source_audit_missing",
    "source_integrity_not_ready"
  ],
  "evaluated_at": "2026-08-16T11:55:58Z",
  "evidence": [
    "evaluation_registry:sha256:b1d4738b7813c0f994d7e707af4feebaedea5db98703f50399902213d0fcf239",
    "schemas:sha256:2b6a5c8ae5788745ba007af0b122b385b79467cc80c01829a06dd83a3e6f7df9",
    "source_registry:sha256:e0a3b7d3e680add29ebb2632d5f77b361026ad90393cb9898153b3ffaaf554c9"
  ],
  "existing_lake_audit_ready": false,
  "foundation_acquisition_authorized": false,
  "foundation_transform_ready": false,
  "gate_id": "phase0-public-foundation-v1",
  "licensing_ready": true,
  "private_transfer_ready": false,
  "public_confirmatory_ready": false,
  "public_foundation_ready": false,
  "quarantine_ready": false,
  "schema_version": "1.0.0",
  "schemas_frozen": true,
  "source_integrity_ready": false,
  "training_authorized": false
}
